{
  "enabled": true,
  "provider": "pokeapi",
  "apiDataRepository": "PokeAPI/api-data",
  "apiDataCommit": "latest",
  "spriteRepository": "PokeAPI/sprites",
  "spriteCommit": "latest",
  "versionGroup": "scarlet-violet",
  "maxNationalDex": 1025,
  "includeNonDefaultForms": true,
  "includeItems": false,
  "maxItems": null,
  "language": "en",
  "downloadSprites": true,
  "includeShinySprites": true,
  "concurrency": 12,
  "warnOnInheritedFields": [
    "types",
    "stats",
    "abilities",
    "learnset",
    "evolutions"
  ],
  "pokemonScope": "hack-only",
  "includedPokemonKeys": [
    "abomasnow",
    "abra",
    "absol",
    "aerodactyl",
    "aggron",
    "aipom",
    "alakazam",
    "altaria",
    "ambipom",
    "ampharos",
    "annihilape",
    "anorith",
    "arbok",
    "arcanine",
    "arcanine-hisui",
    "arceus",
    "ariados",
    "armaldo",
    "aron",
    "articuno",
    "articuno-galar",
    "azelf",
    "azumarill",
    "azurill",
    "bagon",
    "baltoy",
    "banette",
    "barboach",
    "bastiodon",
    "bayleef",
    "beautifly",
    "beedrill",
    "beldum",
    "bellossom",
    "bellsprout",
    "bibarel",
    "bidoof",
    "blastoise",
    "blaziken",
    "blissey",
    "bonsly",
    "breloom",
    "bronzong",
    "bronzor",
    "budew",
    "buizel",
    "bulbasaur",
    "buneary",
    "burmy",
    "butterfree",
    "cacnea",
    "cacturne",
    "camerupt",
    "carnivine",
    "carvanha",
    "cascoon",
    "castform",
    "caterpie",
    "celebi",
    "chansey",
    "charizard",
    "charmander",
    "charmeleon",
    "chatot",
    "cherrim",
    "cherubi",
    "chikorita",
    "chimchar",
    "chimecho",
    "chinchou",
    "chingling",
    "clamperl",
    "claydol",
    "clefable",
    "clefairy",
    "cleffa",
    "clodsire",
    "cloyster",
    "combee",
    "combusken",
    "corphish",
    "corsola",
    "corsola-galar",
    "cradily",
    "cranidos",
    "crawdaunt",
    "cresselia",
    "croagunk",
    "crobat",
    "croconaw",
    "cubone",
    "cursola",
    "cyndaquil",
    "darkrai",
    "delcatty",
    "delibird",
    "deoxys-attack",
    "deoxys-defense",
    "deoxys-normal",
    "deoxys-speed",
    "dewgong",
    "dialga",
    "dialga-origin",
    "diglett",
    "diglett-alola",
    "ditto",
    "dodrio",
    "doduo",
    "donphan",
    "dragonair",
    "dragonite",
    "drapion",
    "dratini",
    "drifblim",
    "drifloon",
    "drowzee",
    "dudunsparce-two-segment",
    "dugtrio",
    "dugtrio-alola",
    "dunsparce",
    "dusclops",
    "dusknoir",
    "duskull",
    "dustox",
    "eevee",
    "ekans",
    "electabuzz",
    "electivire",
    "electrike",
    "electrode",
    "electrode-hisui",
    "elekid",
    "empoleon",
    "entei",
    "espeon",
    "exeggcute",
    "exeggutor",
    "exeggutor-alola",
    "exploud",
    "farfetchd",
    "farfetchd-galar",
    "farigiraf",
    "fearow",
    "feebas",
    "feraligatr",
    "finneon",
    "flaaffy",
    "flareon",
    "floatzel",
    "flutter-mane",
    "flygon",
    "forretress",
    "froslass",
    "furret",
    "gabite",
    "gallade",
    "garchomp",
    "gardevoir",
    "gastly",
    "gastrodon",
    "gengar",
    "geodude",
    "geodude-alola",
    "gible",
    "girafarig",
    "giratina-altered",
    "giratina-origin",
    "glaceon",
    "glalie",
    "glameow",
    "gligar",
    "gliscor",
    "gloom",
    "golbat",
    "goldeen",
    "golduck",
    "golem",
    "golem-alola",
    "gorebyss",
    "gouging-fire",
    "granbull",
    "graveler",
    "graveler-alola",
    "great-tusk",
    "grimer",
    "grimer-alola",
    "grotle",
    "groudon",
    "grovyle",
    "growlithe",
    "growlithe-hisui",
    "grumpig",
    "gulpin",
    "gyarados",
    "happiny",
    "hariyama",
    "haunter",
    "heatran",
    "heracross",
    "hippopotas",
    "hippowdon",
    "hitmonchan",
    "hitmonlee",
    "hitmontop",
    "ho-oh",
    "honchkrow",
    "hoothoot",
    "hoppip",
    "horsea",
    "houndoom",
    "houndour",
    "huntail",
    "hypno",
    "igglybuff",
    "illumise",
    "infernape",
    "iron-bundle",
    "iron-hands",
    "iron-thorns",
    "iron-treads",
    "iron-valiant",
    "ivysaur",
    "jigglypuff",
    "jirachi",
    "jolteon",
    "jumpluff",
    "jynx",
    "kabuto",
    "kabutops",
    "kadabra",
    "kakuna",
    "kangaskhan",
    "kecleon",
    "kingdra",
    "kingler",
    "kirlia",
    "kleavor",
    "koffing",
    "krabby",
    "kricketot",
    "kricketune",
    "kyogre",
    "lairon",
    "lanturn",
    "lapras",
    "larvitar",
    "latias",
    "latios",
    "leafeon",
    "ledian",
    "ledyba",
    "lickilicky",
    "lickitung",
    "lileep",
    "linoone",
    "linoone-galar",
    "lombre",
    "lopunny",
    "lotad",
    "loudred",
    "lucario",
    "ludicolo",
    "lugia",
    "lumineon",
    "lunatone",
    "luvdisc",
    "luxio",
    "luxray",
    "machamp",
    "machoke",
    "machop",
    "magby",
    "magcargo",
    "magikarp",
    "magmar",
    "magmortar",
    "magnemite",
    "magneton",
    "magnezone",
    "makuhita",
    "mamoswine",
    "manaphy",
    "manectric",
    "mankey",
    "mantine",
    "mantyke",
    "mareep",
    "marill",
    "marowak",
    "marowak-alola",
    "marshtomp",
    "masquerain",
    "mawile",
    "medicham",
    "meditite",
    "meganium",
    "meowth",
    "meowth-alola",
    "meowth-galar",
    "mesprit",
    "metagross",
    "metang",
    "metapod",
    "mew",
    "mewtwo",
    "mightyena",
    "milotic",
    "miltank",
    "mime-jr",
    "minun",
    "misdreavus",
    "mismagius",
    "moltres",
    "moltres-galar",
    "monferno",
    "mothim",
    "mr-mime",
    "mr-mime-galar",
    "mr-rime",
    "mudkip",
    "muk",
    "muk-alola",
    "munchlax",
    "murkrow",
    "natu",
    "nidoking",
    "nidoqueen",
    "nidoran-f",
    "nidoran-m",
    "nidorina",
    "nidorino",
    "nincada",
    "ninetales",
    "ninetales-alola",
    "ninjask",
    "noctowl",
    "nosepass",
    "numel",
    "nuzleaf",
    "obstagoon",
    "octillery",
    "oddish",
    "omanyte",
    "omastar",
    "onix",
    "overqwil",
    "pachirisu",
    "palkia",
    "palkia-origin",
    "paras",
    "parasect",
    "pelipper",
    "perrserker",
    "persian",
    "persian-alola",
    "phanpy",
    "phione",
    "pichu",
    "pidgeot",
    "pidgeotto",
    "pidgey",
    "pikachu",
    "piloswine",
    "pineco",
    "pinsir",
    "piplup",
    "plusle",
    "politoed",
    "poliwag",
    "poliwhirl",
    "poliwrath",
    "ponyta",
    "ponyta-galar",
    "poochyena",
    "porygon",
    "porygon-z",
    "porygon2",
    "primeape",
    "prinplup",
    "probopass",
    "psyduck",
    "pupitar",
    "purugly",
    "quagsire",
    "quilava",
    "qwilfish",
    "qwilfish-hisui",
    "raging-bolt",
    "raichu",
    "raichu-alola",
    "raikou",
    "ralts",
    "rampardos",
    "rapidash",
    "rapidash-galar",
    "raticate",
    "raticate-alola",
    "rattata",
    "rattata-alola",
    "rayquaza",
    "regice",
    "regigigas",
    "regirock",
    "registeel",
    "relicanth",
    "remoraid",
    "rhydon",
    "rhyhorn",
    "rhyperior",
    "riolu",
    "roaring-moon",
    "roselia",
    "roserade",
    "rotom",
    "rotom-fan",
    "rotom-frost",
    "rotom-heat",
    "rotom-mow",
    "rotom-wash",
    "sableye",
    "salamence",
    "sandshrew",
    "sandshrew-alola",
    "sandslash",
    "sandslash-alola",
    "sandy-shocks",
    "sceptile",
    "scizor",
    "scream-tail",
    "scyther",
    "seadra",
    "seaking",
    "sealeo",
    "seedot",
    "seel",
    "sentret",
    "seviper",
    "sharpedo",
    "shaymin-land",
    "shaymin-sky",
    "shedinja",
    "shelgon",
    "shellder",
    "shellos",
    "shieldon",
    "shiftry",
    "shinx",
    "shroomish",
    "shuckle",
    "shuppet",
    "silcoon",
    "sirfetchd",
    "skarmory",
    "skiploom",
    "skitty",
    "skorupi",
    "skuntank",
    "slaking",
    "slakoth",
    "slowbro",
    "slowbro-galar",
    "slowking",
    "slowking-galar",
    "slowpoke",
    "slowpoke-galar",
    "slugma",
    "smeargle",
    "smoochum",
    "sneasel",
    "sneasel-hisui",
    "sneasler",
    "snorlax",
    "snorunt",
    "snover",
    "snubbull",
    "solrock",
    "spearow",
    "spheal",
    "spinarak",
    "spinda",
    "spiritomb",
    "spoink",
    "squirtle",
    "stantler",
    "staraptor",
    "staravia",
    "starly",
    "starmie",
    "staryu",
    "steelix",
    "stunky",
    "sudowoodo",
    "suicune",
    "sunflora",
    "sunkern",
    "surskit",
    "swablu",
    "swalot",
    "swampert",
    "swellow",
    "swinub",
    "sylveon",
    "taillow",
    "tangela",
    "tangrowth",
    "tauros",
    "teddiursa",
    "tentacool",
    "tentacruel",
    "togekiss",
    "togepi",
    "togetic",
    "torchic",
    "torkoal",
    "torterra",
    "totodile",
    "toxicroak",
    "trapinch",
    "treecko",
    "tropius",
    "turtwig",
    "typhlosion",
    "typhlosion-hisui",
    "tyranitar",
    "tyrogue",
    "umbreon",
    "unown",
    "ursaluna",
    "ursaluna-bloodmoon",
    "ursaring",
    "uxie",
    "vaporeon",
    "venomoth",
    "venonat",
    "venusaur",
    "vespiquen",
    "vibrava",
    "victreebel",
    "vigoroth",
    "vileplume",
    "volbeat",
    "voltorb",
    "voltorb-hisui",
    "vulpix",
    "vulpix-alola",
    "wailmer",
    "wailord",
    "walking-wake",
    "walrein",
    "wartortle",
    "weavile",
    "weedle",
    "weepinbell",
    "weezing",
    "weezing-galar",
    "whiscash",
    "whismur",
    "wigglytuff",
    "wingull",
    "wobbuffet",
    "wooper",
    "wooper-paldea",
    "wormadam-plant",
    "wormadam-sandy",
    "wormadam-trash",
    "wurmple",
    "wynaut",
    "wyrdeer",
    "xatu",
    "yanma",
    "yanmega",
    "zangoose",
    "zapdos",
    "zapdos-galar",
    "zigzagoon",
    "zigzagoon-galar",
    "zubat"
  ],
  "includeBaselineLearnsets": false,
  "fallbackMoveIds": [
    1,
    2,
    3,
    4,
    5,
    6,
    7,
    8,
    9,
    10,
    11,
    12,